[
  {
    "name": "Accumulator Servo",
    "description": "Deal Area Damage equal to 278%~500% damage taken in the past 10 seconds.",
    "hero": "All",
    "drop": "Chaos 1 - Chaos 10",
    "type": "Relic",
    "image": "https://raw.githubusercontent.com/Cryotalis/Protobot-TS/refs/heads/main/assets/Misc_Icons/Defense_Sword_Icon.png"
  },
  {
    "name": "Empowering Claws",
    "description": "Each Werewolf Commander melee attack generates a stack that increases the damage of its ranged attacks by 39%~50%. Stacks up to 6 times. Stacks are lost after 10 seconds of no melee hits.",
    "hero": "Hunter",
    "drop": "Chaos 1 - Chaos 10",
    "type": "Relic",
    "image": "https://raw.githubusercontent.com/Cryotalis/Protobot-TS/refs/heads/main/assets/Misc_Icons/Defense_Sword_Icon.png"
  },
  {
    "name": "Anti Heal Servo",
    "description": "Reduce Healing of enemies by 70%~100% for 15 seconds.",
    "hero": "All",
    "drop": "Chaos 10",
    "type": "Relic",
    "image": "https://raw.githubusercontent.com/Cryotalis/Protobot-TS/refs/heads/main/assets/Misc_Icons/Defense_Sword_Icon.png"
  },
  {
    "name": "Anti-Chaos Servo",
    "description": "+30.58%~50% Damage to Chaos enemies.",
    "hero": "All",
    "drop": "Chaos 6 - Chaos 10",
    "type": "Relic",
    "image": "https://raw.githubusercontent.com/Cryotalis/Protobot-TS/refs/heads/main/assets/Misc_Icons/Defense_Sword_Icon.png"
  },
  {
    "name": "Anti-Frost Servo",
    "description": "+30.58%~50% Damage to Frosty enemies.",
    "hero": "All",
    "drop": "Chaos 8 - Chaos 10",
    "type": "Relic",
    "image": "https://raw.githubusercontent.com/Cryotalis/Protobot-TS/refs/heads/main/assets/Misc_Icons/Defense_Sword_Icon.png"
  },
  {
    "name": "Anti-Goblin Servo",
    "description": "+36.28%~60% Damage to Goblins.",
    "hero": "All",
    "drop": "Chaos 1 - Chaos 10",
    "type": "Relic",
    "image": "https://raw.githubusercontent.com/Cryotalis/Protobot-TS/refs/heads/main/assets/Misc_Icons/Defense_Sword_Icon.png"
  },
  {
    "name": "Anti-Melee Servo",
    "description": "+24.87%~40% Damage to Melee enemies.",
    "hero": "All",
    "drop": "Chaos 3 - Chaos 10",
    "type": "Relic",
    "image": "https://raw.githubusercontent.com/Cryotalis/Protobot-TS/refs/heads/main/assets/Misc_Icons/Defense_Sword_Icon.png"
  },
  {
    "name": "Anti-Miniboss Servo",
    "description": "+30.58%~50% Damage to Minibosses.",
    "hero": "All",
    "drop": "Chaos 5 - Chaos 10",
    "type": "Relic",
    "image": "https://raw.githubusercontent.com/Cryotalis/Protobot-TS/refs/heads/main/assets/Misc_Icons/Defense_Sword_Icon.png"
  },
  {
    "name": "Anti-Orc Servo",
    "description": "+36.28%~60% Damage to Orcs.",
    "hero": "All",
    "drop": "Campaign - Chaos 10",
    "type": "Relic",
    "image": "https://raw.githubusercontent.com/Cryotalis/Protobot-TS/refs/heads/main/assets/Misc_Icons/Defense_Sword_Icon.png"
  },
  {
    "name": "Anti-Ranged Servo",
    "description": "+24.87%~40% Damage to Ranged enemies.",
    "hero": "All",
    "drop": "Chaos 4 - Chaos 10",
    "type": "Relic",
    "image": "https://raw.githubusercontent.com/Cryotalis/Protobot-TS/refs/heads/main/assets/Misc_Icons/Defense_Sword_Icon.png"
  },
  {
    "name": "Anti-Skeleton Servo",
    "description": "+36.28%~60% Damage to Skeletons.",
    "hero": "All",
    "drop": "Chaos 1 - Chaos 10",
    "type": "Relic",
    "image": "https://raw.githubusercontent.com/Cryotalis/Protobot-TS/refs/heads/main/assets/Misc_Icons/Defense_Sword_Icon.png"
  },
  {
    "name": "Anti-Support Servo",
    "description": "+30.58%~50% Damage to Support enemies.",
    "hero": "All",
    "drop": "Chaos 3 - Chaos 10",
    "type": "Relic",
    "image": "https://raw.githubusercontent.com/Cryotalis/Protobot-TS/refs/heads/main/assets/Misc_Icons/Defense_Sword_Icon.png"
  },
  {
    "name": "Anti-Warboar Servo",
    "description": "+36.28%~60% Damage to Warboars.",
    "hero": "All",
    "drop": "Chaos 1 - Chaos 10",
    "type": "Relic",
    "image": "https://raw.githubusercontent.com/Cryotalis/Protobot-TS/refs/heads/main/assets/Misc_Icons/Defense_Sword_Icon.png"
  },
  {
    "name": "Boar-Boom Servo",
    "description": "Warboars explode when killed dealing around 295,496~400,000 as area damage, depending on enemy type.",
    "hero": "All",
    "drop": "Chaos 1 - Chaos 10",
    "type": "Relic",
    "image": "https://raw.githubusercontent.com/Cryotalis/Protobot-TS/refs/heads/main/assets/Misc_Icons/Defense_Sword_Icon.png"
  },
  {
    "name": "Burning Bolts",
    "description": "+11.99~20% extra Fire damage over 7.05~10 seconds when hit by Ballista and attunes the tower to Fire.",
    "hero": "Squire",
    "drop": "Squire Drop",
    "type": "Relic",
    "image": "https://raw.githubusercontent.com/Cryotalis/Protobot-TS/refs/heads/main/assets/Misc_Icons/Defense_Sword_Icon.png"
  },
  {
    "name": "Chain Detonator",
    "description": "Enables the Physical Wall to set off explosions at each node when a projectile passes through the chain, dealing 31%~40% of Defense Health.",
    "hero": "Cyborg",
    "drop": "Cyborg Drop",
    "type": "Relic",
    "image": "https://raw.githubusercontent.com/Cryotalis/Protobot-TS/refs/heads/main/assets/Misc_Icons/Defense_Sword_Icon.png"
  },
  {
    "name": "Chaos-Boom Servo",
    "description": "Chaos enemies explode when killed dealing around 147,748~200,000 as area damage, depending on enemy type.",
    "hero": "All",
    "drop": "Chaos 6 - Chaos 10",
    "type": "Relic",
    "image": "https://raw.githubusercontent.com/Cryotalis/Protobot-TS/refs/heads/main/assets/Misc_Icons/Defense_Sword_Icon.png"
  },
  {
    "name": "Controller Servo",
    "description": "+22.02%~35% Damage to crowd controlled enemies.",
    "hero": "All",
    "drop": "Chaos 5 - Chaos 10",
    "type": "Relic",
    "image": "https://raw.githubusercontent.com/Cryotalis/Protobot-TS/refs/heads/main/assets/Misc_Icons/Defense_Sword_Icon.png"
  },
  {
    "name": "Crit Damage Servo",
    "description": "+23%~35% Critical Damage.",
    "hero": "All",
    "drop": "Chaos 5 - Chaos 10",
    "type": "Relic",
    "image": "https://raw.githubusercontent.com/Cryotalis/Protobot-TS/refs/heads/main/assets/Misc_Icons/Defense_Sword_Icon.png"
  },
  {
    "name": "Critical Chance Servo",
    "description": "+13.54%~25% Defense Critical Chance.",
    "hero": "All",
    "drop": "Chaos 5 - Chaos 10",
    "type": "Relic",
    "image": "https://raw.githubusercontent.com/Cryotalis/Protobot-TS/refs/heads/main/assets/Misc_Icons/Defense_Sword_Icon.png"
  },
  {
    "name": "Damage Buff Servo",
    "description": "+5,740~7,770 Defense Power while buffed.",
    "hero": "All",
    "drop": "Chaos 8 - Chaos 10",
    "type": "Relic",
    "image": "https://raw.githubusercontent.com/Cryotalis/Protobot-TS/refs/heads/main/assets/Misc_Icons/Defense_Sword_Icon.png"
  },
  {
    "name": "Defense Range Servo",
    "description": "+18.5%~30% Defense Attack Range.",
    "hero": "All",
    "drop": "Chaos 6 - Chaos 10",
    "type": "Relic",
    "image": "https://raw.githubusercontent.com/Cryotalis/Protobot-TS/refs/heads/main/assets/Misc_Icons/Defense_Sword_Icon.png"
  },
  {
    "name": "Defense Rate Servo",
    "description": "+27.5%~40% Defense Attack Rate.",
    "hero": "All",
    "drop": "Chaos 4 - Chaos 10",
    "type": "Relic",
    "image": "https://raw.githubusercontent.com/Cryotalis/Protobot-TS/refs/heads/main/assets/Misc_Icons/Defense_Sword_Icon.png"
  },
  {
    "name": "Diverse CD Servo",
    "description": "+6.21%~10% Defense Critical Damage for each unique defense nearby.",
    "hero": "All",
    "drop": "Chaos 3 - Chaos 10",
    "type": "Relic",
    "image": "https://raw.githubusercontent.com/Cryotalis/Protobot-TS/refs/heads/main/assets/Misc_Icons/Defense_Sword_Icon.png"
  },
  {
    "name": "Diverse Critical Servo",
    "description": "+2.98%~6% Defense Critical Chance for each unique defense nearby.",
    "hero": "All",
    "drop": "Chaos 3 - Chaos 10",
    "type": "Relic",
    "image": "https://raw.githubusercontent.com/Cryotalis/Protobot-TS/refs/heads/main/assets/Misc_Icons/Defense_Sword_Icon.png"
  },
  {
    "name": "Diverse Power Servo",
    "description": "+3,434~4,650 Defense Power for each unique Defense nearby.",
    "hero": "All",
    "drop": "Chaos 3 - Chaos 10",
    "type": "Relic",
    "image": "https://raw.githubusercontent.com/Cryotalis/Protobot-TS/refs/heads/main/assets/Misc_Icons/Defense_Sword_Icon.png"
  },
  {
    "name": "Drain Aura",
    "description": "Boost Aura damages enemies for an extra 154%~200% of your Defense Power.",
    "hero": "Monk",
    "drop": "Monk Drop",
    "type": "Relic",
    "image": "https://raw.githubusercontent.com/Cryotalis/Protobot-TS/refs/heads/main/assets/Misc_Icons/Defense_Sword_Icon.png"
  },
  {
    "name": "Earth Counter Servo",
    "description": "50.5%~70% damage to Earth Elementals.",
    "hero": "All",
    "drop": "Elemental Rumble",
    "type": "Relic",
    "image": "https://raw.githubusercontent.com/Cryotalis/Protobot-TS/refs/heads/main/assets/Misc_Icons/Defense_Sword_Icon.png"
  },
  {
    "name": "Earth Servo",
    "description": "Attunes a non-elemental Tower to Earth and increases Defense Power by 2,870~3,885.",
    "hero": "All",
    "drop": "Campaign - Chaos 10",
    "type": "Relic",
    "image": "https://raw.githubusercontent.com/Cryotalis/Protobot-TS/refs/heads/main/assets/Misc_Icons/Defense_Sword_Icon.png"
  },
  {
    "name": "Electric Counter Servo",
    "description": "50.5%~70% damage to Electric Elementals.",
    "hero": "All",
    "drop": "Elemental Rumble",
    "type": "Relic",
    "image": "https://raw.githubusercontent.com/Cryotalis/Protobot-TS/refs/heads/main/assets/Misc_Icons/Defense_Sword_Icon.png"
  },
  {
    "name": "Elite Counter Servo",
    "description": "74%~100% damage to Elite Elementals.",
    "hero": "All",
    "drop": "Elemental Rumble",
    "type": "Relic",